[
  {
    "candidate_backends": [
      "cpu",
      "openmp",
      "task-parallel"
    ],
    "claim_boundary": "Planning metadata only; no Gaussian executable, license, live run, or performance result is bundled or claimed.",
    "edge_suitability": "unsuitable",
    "execution_mode": "solver-native",
    "implementation_languages": [
      "Fortran",
      "C"
    ],
    "interfaces": [
      "cli"
    ],
    "library_candidates": [],
    "limitations": [
      "GPU acceleration is not assumed by this repository; use only versioned vendor-supported capabilities.",
      "Commercial licensing and host-specific environment setup remain mandatory."
    ],
    "parallel_strategies": [
      "shared-memory",
      "task-parallel"
    ],
    "preferred_backends": [
      "openmp",
      "task-parallel",
      "cpu"
    ],
    "probe_hints": [
      "g16 --version",
      "g09 --version"
    ],
    "slug": "gaussian",
    "workflow": "quantum-chemistry"
  },
  {
    "candidate_backends": [
      "cpu",
      "mpi",
      "task-parallel"
    ],
    "claim_boundary": "Planning metadata only; executable detection does not prove ORCA method support, convergence, or speedup.",
    "edge_suitability": "unsuitable",
    "execution_mode": "solver-native",
    "implementation_languages": [
      "C++"
    ],
    "interfaces": [
      "cli"
    ],
    "library_candidates": [],
    "limitations": [
      "Parallel capabilities are version-, method-, and installation-dependent.",
      "No GPU backend is promoted without live versioned evidence."
    ],
    "parallel_strategies": [
      "mpi",
      "task-parallel"
    ],
    "preferred_backends": [
      "mpi",
      "task-parallel",
      "cpu"
    ],
    "probe_hints": [
      "orca --version",
      "mpirun --version"
    ],
    "slug": "orca",
    "workflow": "quantum-chemistry"
  },
  {
    "candidate_backends": [
      "cpu",
      "openmp",
      "task-parallel"
    ],
    "claim_boundary": "Planning metadata only; no live Psi4 calculation or accelerator result is claimed.",
    "edge_suitability": "limited",
    "execution_mode": "solver-native",
    "implementation_languages": [
      "C++",
      "Python"
    ],
    "interfaces": [
      "cli"
    ],
    "library_candidates": [],
    "limitations": [
      "Backend support depends on the installed Psi4 build and selected method.",
      "Large-memory workloads remain workstation or HPC candidates."
    ],
    "parallel_strategies": [
      "shared-memory",
      "task-parallel"
    ],
    "preferred_backends": [
      "openmp",
      "task-parallel",
      "cpu"
    ],
    "probe_hints": [
      "psi4 --version"
    ],
    "slug": "psi4",
    "workflow": "quantum-chemistry"
  },
  {
    "candidate_backends": [
      "cpu",
      "openmp",
      "cuda",
      "task-parallel"
    ],
    "claim_boundary": "Candidate GPU4PySCF integration only; installed modules and supported methods must be probed.",
    "edge_suitability": "limited",
    "execution_mode": "hybrid-library",
    "implementation_languages": [
      "Python",
      "C",
      "C++",
      "CUDA"
    ],
    "interfaces": [
      "python-module"
    ],
    "library_candidates": [
      "cupy",
      "cublas",
      "cusolver"
    ],
    "limitations": [
      "CUDA requires a compatible GPU4PySCF stack and method-specific support.",
      "CPU and GPU energies, gradients, precision, and convergence require comparison."
    ],
    "parallel_strategies": [
      "shared-memory",
      "task-parallel",
      "solver-native"
    ],
    "preferred_backends": [
      "cuda",
      "openmp",
      "task-parallel",
      "cpu"
    ],
    "probe_hints": [
      "python -c \"import pyscf; print(pyscf.__version__)\"",
      "python -c \"import gpu4pyscf\""
    ],
    "slug": "pyscf",
    "workflow": "quantum-chemistry"
  },
  {
    "candidate_backends": [
      "cpu",
      "openmp",
      "mpi",
      "cuda"
    ],
    "claim_boundary": "Candidate backend metadata only; no live Quantum ESPRESSO GPU build or calculation is claimed.",
    "edge_suitability": "unsuitable",
    "execution_mode": "solver-native",
    "implementation_languages": [
      "Fortran",
      "C",
      "CUDA"
    ],
    "interfaces": [
      "cli"
    ],
    "library_candidates": [
      "cublas",
      "cusolver",
      "cufft",
      "nccl"
    ],
    "limitations": [
      "GPU support is build- and version-dependent and must be proven from the executable build.",
      "MPI rank, FFT, k-point, band, and GPU decomposition require workload-specific tuning."
    ],
    "parallel_strategies": [
      "mpi",
      "openmp",
      "solver-native"
    ],
    "preferred_backends": [
      "cuda",
      "mpi",
      "openmp",
      "cpu"
    ],
    "probe_hints": [
      "pw.x --version",
      "ldd $(command -v pw.x)"
    ],
    "slug": "quantum-espresso",
    "workflow": "periodic-dft"
  },
  {
    "candidate_backends": [
      "cpu",
      "openmp",
      "mpi",
      "cuda",
      "hip"
    ],
    "claim_boundary": "Candidate CP2K accelerator metadata only; no live build capability or speedup is claimed.",
    "edge_suitability": "unsuitable",
    "execution_mode": "solver-native",
    "implementation_languages": [
      "Fortran",
      "C",
      "C++",
      "CUDA",
      "HIP"
    ],
    "interfaces": [
      "cli"
    ],
    "library_candidates": [
      "cublas",
      "cusolver",
      "cusparse",
      "cufft",
      "nccl"
    ],
    "limitations": [
      "DBCSR, FFT, grid, and other accelerator paths depend on the exact build.",
      "CPU/GPU decomposition, memory, precision, and scientific equivalence require live benchmarking."
    ],
    "parallel_strategies": [
      "mpi",
      "openmp",
      "solver-native"
    ],
    "preferred_backends": [
      "cuda",
      "hip",
      "mpi",
      "openmp",
      "cpu"
    ],
    "probe_hints": [
      "cp2k --version",
      "cp2k.psmp --version"
    ],
    "slug": "cp2k",
    "workflow": "periodic-dft"
  },
  {
    "candidate_backends": [
      "cpu",
      "openmp",
      "mpi",
      "cuda"
    ],
    "claim_boundary": "Planning metadata only; no VASP executable, license, live run, or GPU performance is claimed.",
    "edge_suitability": "unsuitable",
    "execution_mode": "solver-native",
    "implementation_languages": [
      "Fortran",
      "C",
      "OpenACC"
    ],
    "interfaces": [
      "cli"
    ],
    "library_candidates": [
      "cublas",
      "cusolver",
      "cufft",
      "nccl"
    ],
    "limitations": [
      "GPU support requires a licensed, correctly built accelerator-enabled VASP executable.",
      "Method support, MPI layout, precision, pseudopotentials, and license authorization remain external."
    ],
    "parallel_strategies": [
      "mpi",
      "openmp",
      "solver-native"
    ],
    "preferred_backends": [
      "cuda",
      "mpi",
      "openmp",
      "cpu"
    ],
    "probe_hints": [
      "vasp_std --version"
    ],
    "slug": "vasp",
    "workflow": "periodic-dft"
  },
  {
    "candidate_backends": [
      "cpu",
      "openmp",
      "mpi",
      "cuda"
    ],
    "claim_boundary": "Candidate ABACUS acceleration metadata only; no installed GPU build or calculation is claimed.",
    "edge_suitability": "unsuitable",
    "execution_mode": "solver-native",
    "implementation_languages": [
      "C++",
      "CUDA"
    ],
    "interfaces": [
      "cli"
    ],
    "library_candidates": [
      "cublas",
      "cusolver",
      "cufft",
      "nccl"
    ],
    "limitations": [
      "Accelerator coverage is method- and build-dependent.",
      "Numerical equivalence, memory, and scaling require a versioned live test."
    ],
    "parallel_strategies": [
      "mpi",
      "openmp",
      "solver-native"
    ],
    "preferred_backends": [
      "cuda",
      "mpi",
      "openmp",
      "cpu"
    ],
    "probe_hints": [
      "ABACUS --version"
    ],
    "slug": "abacus",
    "workflow": "periodic-dft"
  },
  {
    "candidate_backends": [
      "cpu",
      "mpi",
      "cuda",
      "task-parallel"
    ],
    "claim_boundary": "Candidate GPAW GPU metadata only; installed support and scientific equivalence are not assumed.",
    "edge_suitability": "limited",
    "execution_mode": "hybrid-library",
    "implementation_languages": [
      "Python",
      "C",
      "C++",
      "CUDA"
    ],
    "interfaces": [
      "cli",
      "python-module"
    ],
    "library_candidates": [
      "cupy",
      "cublas",
      "cufft"
    ],
    "limitations": [
      "GPU functionality is limited to supported GPAW modes and versions.",
      "Mode, precision, domain decomposition, and CPU reference comparison are mandatory."
    ],
    "parallel_strategies": [
      "mpi",
      "task-parallel",
      "solver-native"
    ],
    "preferred_backends": [
      "cuda",
      "mpi",
      "task-parallel",
      "cpu"
    ],
    "probe_hints": [
      "gpaw info",
      "python -c \"import gpaw; print(gpaw.__version__)\""
    ],
    "slug": "gpaw",
    "workflow": "periodic-dft"
  },
  {
    "candidate_backends": [
      "cpu",
      "task-parallel",
      "remote"
    ],
    "claim_boundary": "Orchestration acceleration only; no downstream solver execution or GPU benefit is implied.",
    "edge_suitability": "suitable",
    "execution_mode": "orchestration",
    "implementation_languages": [
      "Python"
    ],
    "interfaces": [
      "python-module"
    ],
    "library_candidates": [
      "rapids-cudf"
    ],
    "limitations": [
      "ASE and pymatgen primarily orchestrate and transform data; solver acceleration is delegated.",
      "GPU dataframe acceleration is useful only for sufficiently large preprocessing workloads."
    ],
    "parallel_strategies": [
      "task-parallel",
      "remote"
    ],
    "preferred_backends": [
      "task-parallel",
      "remote",
      "cpu"
    ],
    "probe_hints": [
      "python -c \"import ase, pymatgen\""
    ],
    "slug": "ase-pymatgen",